"問題","答案"
"Q9. What are the most extensively used cryptographic algorithms?","The most important of them are: 1. RSA 2. Triple DES 3. Blowfish 4. Twofish 5. AES"
"Q10. Is RSA a secure algorithm?","Yes, RSA is a very secure algorithm. But there are different ways that this algorithm is attacked."
"Q11. Does Secret Sharing have any significance in blockchain technology?","Security is the most important part of a digital transaction and developers have used the approach of Secret Sharing for this very purpose."
"Q12. What are off chain transactions?","Off Chain Transactions are the movements of value that are placed outside the blockchain."
"Q13. Which threats to information have you come across?","Threats to information are increasing on a daily basis. Listing out the threats you should talk about the threats that you face."
"Q14. Have you heard of the 51% attack?","Yes, it occurs when a group of people hold greater than 50% Network Hash Rate."
"Q15. What elements make up the block of a blockchain?","There are three main elements: 1. Timestamp 2. Hash pointer 3. List of transactions"
"Q16. In what order are the blocks linked in the blockchain?","Blocks are always linked in a backward order."
"Q17. What are the perils of information leak to an organisation?","Not only can an information bring a company into crisis due to reputation harm, but it can also bring about financial losses."
"Q18. Is there a way that a block may be recognised in a Blockchain?","Yes, every block has a pointer that acts as a link to find it."
"Q19. Can you modify the data in a block?","No. Once you have saved the information, to modify it, you would have to erase all information that rests on other associated blocks."
"Q20. How can blocks be identified?","Blocks can be identified by their height and block."
"Q21. Can you remove a complete block from a network?","Yes, it may. There are default options and filters that can help us do this."
"Q22. When a distributed digital ledger records a transaction in Blockchain. In this instance, what does the system rely on?","Network Servicing Protocol & Nodes of Network are there to be relied on in such an instance."
"Q23. Where is a blockchain stored?","It can be either stored as a flat file or as a database."
